date,places
17.01.2023,"Абрит, Балчик, Българево, Гешаново, Градница, Добрич, Дропла, Каварна, Коритен, Кранево, Крушари, Стожер, Тервел"
16.01.2023,"Балчик, Добрич, Зограф, Изворово, Каварна, Могилище, Овчарово, Славеево, Стефаново, Стожер"
15.01.2023,"Добрич, Орлова могила"
14.01.2023,"Балчик, Добрич, Соколово"
13.01.2023,"Балчик, Воднянци, Гурково, Добрич, Каварна, Крушари, Соколово, Царичино"
12.01.2023,"Алцек, Балчик, Българево, Воднянци, Добрич, Изворово, Каварна, Крушари, Овчарово, Орляк, Северци, Соколово, Тервел, Хитово, Шабла"
11.01.2023,"Балканци, Балчик, Бенковски, Българево, Видно, Добрич, Изворово, Каварна, Карвуна, Кранево, Одринци, Соколово, Тюленово, Царичино, Шабла"
10.01.2023,"Балканци, Балчик, Българево, Градница, Добрич, Житница, Изворово, Каблешково, Каварна, Кранево, Крушари, Миладиновци, Сенокос, Телериг, Тервел, Тюленово, Тянево, Хаджи Димитър, Царичино, Шабла"
09.01.2023,"Безмер, Бенковски, Добрич, Дончево, Енево, Каварна, Крушари, Медово, Тервел, Узово, Хаджи Димитър"
06.01.2023,"Абрит, Балчик, Добрич, Дропла, Изворово, Каварна, Крушари, Тервел, Тянево, Царичино, Шабла"
05.01.2023,"Балчик, Бистрец, Добрич, Жегларци, Каварна, Коларци, Крушари, Пчеларово, Свети Никола, Сенокос, Средина, Тервел"
04.01.2023,"Абрит, Балчик, Богдан, Божурово, Брястово, Градница, Добрич, Каварна, Карапелит, Крапец, Крушари, Спасово, Тервел, Тригорци, Шабла"
03.01.2023,"Абрит, Балканци, Добрич, Козлодуйци, Крушари, Лозенец, Тервел, Тянево, Шабла"
02.01.2023,"Добрич, Козлодуйци"
01.01.2023,"Добрич, Козлодуйци"
31.12.2022,"Божурово, Добрич, Каварна, Паскалево, Росеново"
30.12.2022,"Балчик, Божаново, Добрич, Красен, Оброчище, Стожер, Шабла"
29.12.2022,"Александрия, Бистрец, Божурово, Видно, Габер, Добрич, Загорци, Земенци, Зимница, Каварна, Красен, Крушари, Огняново, Одърци, Паскалево, Росеново, Шабла"
28.12.2022,"Александрия, Бистрец, Божурец, Габер, Гешаново, Добрич, Загорци, Земенци, Зимница, Каварна, Крушари, Огняново"
27.12.2022,"Александрия, Бистрец, Божурово, Габер, Добрево, Добрич, Загорци, Земенци, Зимница, Крушари, Ломница, Овчарово, Огняново, Паскалево, Росеново, Сливенци, Царевец"
26.12.2022,"Бенковски, Добрич, Енево, Крушари, Медово"
25.12.2022,"Александрия, Бистрец, Габер, Добрич, Загорци, Земенци, Зимница, Каварна, Крушари, Огняново, Стожер"
24.12.2022,"Александрия, Бистрец, Добрич, Загорци, Земенци, Каварна, Крушари, Хаджи Димитър"
23.12.2022,"Воднянци, Вранино, Дебрене, Добрич, Зърнево, Каварна, Подслон, Тервел"
22.12.2022,"Балчик, Воднянци, Габер, Добрич, Каварна, Кранево, Крапец, Крушари, Къпиново, Орляк, Пролез, Рогачево, Росен, Смолница, Тервел, Тюленово, Царичино, Шабла"
21.12.2022,"Абрит, Балчик, Божаново, Добрич, Езерец, Житен, Коларци, Кранево, Крапец, Крушари, Лозенец, Малка Смолница, Пролез, Росеново, Смолница, Сърнино, Тервел, Тюленово, Царичино, Шабла"
20.12.2022,"Балчик, Божан, Божаново, Владимирово, Добрич, Изворово, Каварна, Кремена, Ново Ботево, Овчарово, Орляк, Тервел, Шабла"
19.12.2022,"Балчик, Батово, Бенковски, Божаново, Добрич, Изворово, Каварна, Оброчище, Шабла"
17.12.2022,"Балчик, Божаново, Добрич, Зимница, Крушари, Сенокос, Шабла"
16.12.2022,"Балчик, Божаново, Брястово, Великово, Горичане, Добрич, Златия, Изворово, Крушари, Тригорци, Шабла"
15.12.2022,"Балчик, Ведрина, Добрич, Росица"
14.12.2022,"Балчик, Батово, Бенковски, Добрич, Изворово, Каварна, Крупен, Крушари, Лозенец, Одърци, Пролез, Пчелник, Славеево, Соколник, Стефаново, Стожер, Тервел, Хитово, Шабла"
13.12.2022,"Балчик, Бистрец, Богдан, Добрич, Житница, Захари Стояново, Изворово, Каварна, Камен, Камен бряг, Крушари, Росица, Соколово, Шабла"
12.12.2022,"Балканци, Балчик, Бистрец, Бонево, Добрич, Изворово, Каварна, Камен, Камен бряг, Крушари, Подслон, Самуилово, Телериг, Тервел, Тюленово, Шабла"
11.12.2022,"Божурово, Добрич, Паскалево, Росеново"
10.12.2022,"Добрич, Тюленово, Шабла"
09.12.2022,"Балчик, Добрич, Змеево, Зърнево, Каварна, Кардам, Конаре, Крушари, Ловчанци, Раковски, Тервел, Тюленово, Шабла"
08.12.2022,"Балчик, Богдан, Добрич, Змеево, Каварна, Камен, Камен бряг, Конаре, Опанец, Селце, Тервел, Тюленово, Шабла"
07.12.2022,"Балканци, Балчик, Добрич, Езерец, Змеево, Каварна, Кардам, Ловчанци, Хаджи Димитър, Шабла"
06.12.2022,"Балчик, Горичане, Добрич, Житница, Каварна, Конаре, Кочмар, Кремена, Крушари, Могилище, Пчелино, Росица, Смолница, Тервел, Шабла"
05.12.2022,"Балчик, Добрич, Дропла, Карапелит, Кремена, Ловчанци, Ново Ботево, Смолница"
04.12.2022,"Безмер, Добрич, Жегларци, Тервел"
03.12.2022,"Балчик, Добрич, Кочмар, Тервел"
02.12.2022,"Балканци, Балчик, Батово, Безмер, Добрич, Каварна, Кладенци, Коритен, Крушари, Одърци, Орляк, Пчелино, Свобода, Селце, Славеево, Соколник, Стефаново, Телериг, Тервел, Хаджи Димитър, Шабла"
01.12.2022,"Балканци, Балчик, Ведрина, Добрич, Крушари, Лозенец, Шабла"
30.11.2022,"Балчик, Добрич, Житен, Крушари, Стефаново, Телериг"
29.11.2022,"Балчик, Добрич, Изворово, Орляк, Стефаново, Тервел, Шабла"
28.11.2022,"Абрит, Балчик, Батово, Безмер, Добрич, Каварна, Кранево, Крушари, Огражден, Свобода, Спасово, Тервел, Хаджи Димитър, Шабла"
27.11.2022,"Добрич, Стефаново"
25.11.2022,"Александрия, Ангеларий, Балик, Балчик, Добрич, Крушари, Малина, Сенокос, Тервел"
24.11.2022,"Балчик, Градини, Добрич, Златия, Кремена, Крушари, Тервел"
23.11.2022,"Балик, Добрич, Крушари, Лозенец, Опанец, Тервел"
22.11.2022,"Балчик, Добрич, Каварна, Камен, Камен бряг, Карапелит, Крушари, Лозенец, Победа, Телериг, Тервел"
21.11.2022,"Балчик, Добрич, Изворово, Каварна, Кардам, Селце, Тервел, Чернооково"
19.11.2022,"Добрич, Каварна, Шабла"
18.11.2022,"Балчик, Безводица, Горун, Добрич, Змеево, Каварна, Кранево, Крушари, Лозенец, Орляк, Присад, Стефан Караджа, Телериг, Тервел, Чернооково, Шабла"
17.11.2022,"Балчик, Добрич, Житница, Змеево, Иречек, Каблешково, Каварна, Карапелит, Крушари, Лозенец, Тервел, Шабла"
16.11.2022,"Балчик, Бенковски, Богдан, Бонево, Добрич, Змеево, Каварна, Камен, Камен бряг, Крушари, Професор Златарски, Септемврийци, Тервел, Топола, Шабла"
15.11.2022,"Балчик, Добрич, Змеево, Каварна, Кочмар, Крушари, Малка Смолница, Смолница, Тервел, Хаджи Димитър"
14.11.2022,"Балчик, Добрич, Дъбрава, Жегларци, Змеево, Изворово, Каварна, Кардам, Крушари, Лозенец, Могилище, Огняново, Огражден, Одринци, Паскалево, Пролез, Селце, Тервел, Тюленово, Шабла"
12.11.2022,Добрич
11.11.2022,"Балчик, Ведрина, Добрич, Каварна, Карапелит, Кочмар, Подслон, Пролез, Тервел, Царевец, Шабла"
10.11.2022,"Балчик, Гурково, Добрич, Житница, Каварна, Нейково, Ново Ботево, Раковски, Росен, Тюленово, Шабла"
09.11.2022,"Балчик, Ведрина, Гурково, Добрич, Зимница, Каварна, Конаре, Кранево, Крушари, Одринци, Пчеларово, Росеново, Сърнец, Тервел, Шабла"
08.11.2022,"Балик, Балчик, Брястово, Горун, Добрич, Каварна, Карапелит, Смолница, Стефаново, Тервел, Тюленово, Честименско, Шабла"
07.11.2022,"Балчик, Богдан, Горун, Добрич, Драганово, Каварна, Кочмар, Крагулево, Рогачево, Росеново, Смолница, Стефан Караджа, Стражица, Тервел, Тюленово, Чернооково, Шабла"
06.11.2022,"Батово, Добрич, Одърци, Пчелино, Славеево, Соколник, Стефаново"
05.11.2022,"Балчик, Гурково, Добрич, Кранево, Методиево"
04.11.2022,"Балканци, Балчик, Бонево, Добрич, Загорци, Каварна, Кардам, Крушари, Оброчище, Росеново, Северци, Тервел, Шабла"
03.11.2022,"Балчик, Богдан, Добрич, Долина, Житница, Загорци, Каварна, Крушари, Опанец, Сенокос, Спасово, Телериг, Шабла"
02.11.2022,"Балчик, Батово, Бдинци, Бонево, Великово, Вратарите, Добрич, Каблешково, Каварна, Кранево, Крушари, Могилище, Нейково, Одърци, Пчелино, Сенокос, Славеево, Смин, Смолница, Соколово, Спасово, Тервел, Царичино, Честименско, Шабла"
01.11.2022,"Балчик, Батово, Добрич, Долина, Дропла, Житница, Змеево, Козлодуйци, Коритен, Кранево, Кремена, Крушари, Методиево, Одърци, Пчелино, Раковски, Северняк, Славеево, Стожер"
31.10.2022,"Балчик, Белгун, Бистрец, Воднянци, Добрич, Житен, Житница, Каварна, Кардам, Крушари, Ловчанци, Оброчище, Овчарово, Пролез, Сноп, Соколово, Шабла"
28.10.2022,"Бистрец, Българево, Врачанци, Добрич, Долина, Дончево, Каварна, Козлодуйци, Крушари, Пролез, Тюленово, Шабла"
27.10.2022,"Абрит, Балик, Балчик, Божаново, Добрич, Дончево, Каварна, Коритен, Кранево, Красен, Крушари, Нейково, Опанец, Победа, Сърнино, Хаджи Димитър, Шабла"
26.10.2022,"Балчик, Било, Видно, Добрич, Каварна, Красен, Методиево, Орляк, Соколово, Тервел"
25.10.2022,"Батово, Безмер, Било, Врачанци, Градини, Добрич, Долина, Каблешково, Каварна, Кардам, Козлодуйци, Методиево, Одърци, Пчелино, Славеево, Соколник, Сърнец, Тервел, Шабла"
24.10.2022,"Алцек, Балчик, Богдан, Божан, Воднянци, Вранино, Добрич, Каварна, Кладенци, Кранево, Крушари, Пчеларово, Тервел, Топола, Хитово"
22.10.2022,"Балчик, Добрич, Соколово"
21.10.2022,"Александрия, Балчик, Батово, Бенковски, Божурово, Врачанци, Гурково, Добрич, Долина, Каварна, Козлодуйци, Кранево, Крушари, Методиево, Одърци, Паскалево, Победа, Пчелино, Росеново, Славеево, Соколник, Тервел, Топола, Тянево, Царевец, Шабла"
20.10.2022,"Александрия, Балчик, Батово, Богдан, Врачанци, Гурково, Добрич, Долина, Златия, Козлодуйци, Крагулево, Крушари, Оброчище, Рогачево, Свобода, Соколово, Стожер, Тервел, Царичино, Църква"
19.10.2022,"Бистрец, Бранище, Видно, Владимирово, Врачанци, Генерал Тошево, Добрич, Долина, Каварна, Козлодуйци, Крушари, Орляк, Победа, Средина, Тервел, Топола, Узово"
18.10.2022,"Алцек, Балчик, Белгун, Ведрина, Воднянци, Генерал Тошево, Добрич, Змеево, Каварна, Коритен, Крагулево, Кранево, Красен, Крушари, Ловчанци, Миладиновци, Нова Камена, Одринци, Подслон, Тервел, Хитово, Шабла"
17.10.2022,"Балчик, Батово, Божурово, Владимирово, Габер, Главанци, Градница, Гурково, Добрич, Каварна, Камен, Крушари, Методиево, Нова Камена, Огражден, Паскалево, Росеново, Сираково, Сноп, Соколово, Тервел, Тригорци, Тюленово, Честименско, Шабла"
16.10.2022,"Балчик, Добрич, Кранево, Методиево"
15.10.2022,"Балчик, Добрич, Кранево"
14.10.2022,"Балчик, Ведрина, Гешаново, Добрич, Зърнево, Каварна, Малка Смолница, Орляк, Подслон, Смолница, Тервел"
13.10.2022,"Балчик, Белгун, Божурово, Владимирово, Добрич, Дуранкулак, Житен, Каварна, Камен, Красен, Крушари, Малина, Методиево, Орляк, Паскалево, Раковски, Росеново, Соколово, Тервел, Шабла"
12.10.2022,"Балик, Балчик, Белгун, Ведрина, Добрич, Загорци, Каварна, Коларци, Крапец, Крушари, Ловчанци, Миладиновци, Рогачево, Росеново, Селце, Соколово, Спасово, Тервел, Шабла"
11.10.2022,"Балчик, Бистрец, Василево, Врачанци, Гурково, Добрин, Добрич, Долина, Златия, Карапелит, Козлодуйци, Коритен, Крушари, Малка Смолница, Смолница, Стефаново, Хитово, Шабла"
10.10.2022,"Ангеларий, Балик, Балчик, Добрич, Житница, Каварна, Камен, Камен бряг, Капитан Димитрово, Коларци, Котленци, Крушари, Лозенец, Оногур, Приморци, Свети Никола, Сноп, Стефаново, Телериг, Тервел"
07.10.2022,"Балчик, Добрич, Крушари, Тервел, Шабла"
06.10.2022,"Александрия, Балчик, Божурец, Великово, Гешаново, Добрич, Каварна, Кардам, Коритен, Крушари, Поручик Чунчево, Рогачево"
05.10.2022,"Александрия, Балик, Балчик, Ведрина, Вранино, Добрич, Дъбовик, Жегларци, Каварна, Крупен, Крушари, Писарово, Рогачево, Средина, Тервел, Честименско, Шабла"
04.10.2022,"Балчик, Добрич, Каварна, Коритен, Крагулево, Крушари, Могилище, Одринци, Одърци, Победа, Сърнино, Тригорци, Тянево, Шабла"
03.10.2022,"Бонево, Владимирово, Врачанци, Добрич, Каварна, Козлодуйци, Кочмар, Крагулево, Крушари, Орлова могила, Северци, Тервел"
01.10.2022,"Балчик, Врачанци, Добрич, Козлодуйци, Сенокос, Шабла"
30.09.2022,"Балканци, Балчик, Бистрец, Ваклино, Воднянци, Добрич, Каварна, Кардам, Кранево, Крупен, Крушари, Одринци, Росеново, Росица, Селце, Спасово, Стаевци, Шабла"
29.09.2022,"Балчик, Врачанци, Генерал Тошево, Добрич, Дъбрава, Змеево, Каварна, Карапелит, Козлодуйци, Кочмар, Крагулево, Крапец, Крушари, Люляково, Малина, Опанец, Писарово, Пчеларово, Рогозина, Тервел, Шабла"
28.09.2022,"Балчик, Белгун, Божурово, Бранище, Врачанци, Генерал Тошево, Гурково, Добрин, Добрич, Каварна, Козлодуйци, Кранево, Крапец, Крушари, Лозенец, Люляково, Малина, Малка Смолница, Паскалево, Писарово, Плачидол, Подслон, Приморци, Пчеларово, Рогозина, Росеново, Смолница, Сърнец, Тервел, Челопечене, Шабла"
27.09.2022,"Ангеларий, Балчик, Батово, Ведрина, Гурково, Добрич, Долина, Каварна, Камен, Камен бряг, Кардам, Кранево, Крушари, Ловчанци, Лозенец, Ново Ботево, Рогозина, Тервел, Хаджи Димитър, Шабла"
26.09.2022,"Балик, Балчик, Безводица, Гурково, Добрич, Каблешково, Каварна, Козлодуйци, Крушари, Лозенец, Рогозина, Сенокос, Септемврийци, Средина, Тервел, Тригорци, Честименско, Шабла"
25.09.2022,"Балчик, Вичово, Добрич, Рогачево, Спасово"
24.09.2022,"Добрич, Зърнево, Тервел, Черноморци, Шабла"
23.09.2022,"Балчик, Добрич, Житен, Камен, Кардам, Котленци, Кочмар, Крушари, Къпиново, Рогачево, Рогозина, Росен, Соколово, Тервел, Тянево, Шабла"
22.09.2022,"Балчик, Добрич, Рогачево"
21.09.2022,"Балчик, Батово, Добрич, Каварна, Камен, Камен бряг, Крушари, Ляхово, Орляк, Тервел, Царевец, Шабла"
20.09.2022,"Балчик, Добрич, Дропла, Змеево, Каблешково, Каварна, Калина, Карапелит, Крагулево, Крушари, Лозенец, Нейково, Одринци, Тервел, Шабла"
19.09.2022,"Балчик, Бежаново, Безводица, Божан, Брястово, Воднянци, Добрево, Добрич, Каварна, Кочмар, Крагулево, Крупен, Крушари, Лозенец, Ломница, Пчеларово, Свобода, Сливенци, Спасово, Тервел, Царевец, Шабла"
17.09.2022,Добрич
16.09.2022,"Балчик, Батово, Ведрина, Воднянци, Вранино, Гешаново, Добрич, Змеево, Каварна, Карапелит, Кладенци, Кремена, Крушари, Одринци, Подслон, Сърнец, Тервел, Шабла"
15.09.2022,"Балканци, Балчик, Великово, Добрич, Дропла, Каварна, Калина, Камен, Камен бряг, Крушари, Нейково, Подслон, Средина, Телериг, Тервел, Топола, Тянево"
14.09.2022,"Балчик, Батово, Бранище, Ведрина, Горичане, Граничар, Добрич, Каварна, Красен, Крушари, Лясково, Северци, Тервел, Тригорци, Честименско, Шабла"
13.09.2022,"Балчик, Бенковски, Богдан, Владимирово, Врачанци, Градница, Граничар, Добрич, Дончево, Дъбовик, Зограф, Крушари, Методиево, Оброчище, Приморци, Сноп, Средина, Тервел, Тюленово, Узово, Шабла"
12.09.2022,"Абрит, Балчик, Богдан, Българево, Добрич, Каварна, Карапелит, Крушари, Лозенец, Орляк, Победа, Свети Никола, Тервел, Тригорци, Хитово, Шабла"
11.09.2022,"Балчик, Добрич"
10.09.2022,"Балчик, Добрич, Ново Ботево"
09.09.2022,"Балчик, Богдан, Ваклино, Воднянци, Добрич, Долина, Изворово, Каварна, Кардам, Коларци, Крушари, Ловчанци, Приморци, Пчеларово, Септемврийци, Средина, Тервел, Честименско, Шабла"
08.09.2022,"Бежаново, Гешаново, Добрич, Долина, Каварна, Кардам, Коларци, Крушари, Лозенец, Люляково, Малина, Миладиновци, Могилище, Орляк, Писарово, Северняк, Тервел, Тюленово, Шабла"
07.09.2022,"Балчик, Бистрец, Богдан, Добрич, Каварна, Кардам, Крушари, Люляково, Малина, Орлова могила, Писарово, Поручик Чунчево, Тервел, Хаджи Димитър"
06.09.2022,"Богдан, Добрич"
05.09.2022,"Абрит, Балик, Балчик, Ведрина, Главанци, Добрич, Дъбовик, Каблешково, Каварна, Красен, Крушари, Ловчанци, Орляк, Паскалево, Пчелник, Спасово, Тервел, Тригорци, Царичино, Шабла"
03.09.2022,"Бонево, Войниково, Добрич, Каблешково, Тервел, Честименско"
02.09.2022,"Балчик, Батово, Богдан, Бонево, Войниково, Добрич, Дропла, Златия, Змеево, Каблешково, Каварна, Ловчанци, Нова Камена, Орляк, Пчеларово, Тервел, Честименско, Шабла"
