date,places
01.07.2019,"Абрит, Балчик, Батово, Божан, Бранище, Добрич, Каварна, Камен, Кардам, Кранево, Крушари, Оброчище, Смолница, Тервел, Черноморци, Шабла"
30.06.2019,"Добрич, Орлова могила"
28.06.2019,"Батово, Бистрец, Гешаново, Горичане, Добрич, Каварна, Крапец, Крупен, Крушари, Росица, Шабла"
27.06.2019,"Балчик, Батово, Горичане, Добрич, Каварна, Крушари, Лясково, Оброчище, Тервел, Черноморци, Шабла"
26.06.2019,"Балчик, Горичане, Добрич, Каварна, Лясково, Орляк, Сенокос, Славеево, Тервел, Хаджи Димитър, Шабла"
25.06.2019,"Вранино, Горичане, Добрич, Каварна, Кладенци, Козлодуйци, Миладиновци, Росица, Тервел, Шабла"
24.06.2019,"Балчик, Бенковски, Добрич, Каварна, Кардам, Медово, Пчеларово, Сенокос, Сноп, Шабла"
22.06.2019,"Добрич, Крагулево, Крушари, Орляк, Тервел"
21.06.2019,"Балчик, Ведрина, Горичане, Добрич, Каварна, Кранево, Крушари, Оброчище, Одринци, Орляк, Тервел, Топола, Шабла"
20.06.2019,"Балчик, Добрич, Дончево, Езерец, Каварна, Козлодуйци, Спасово, Стефаново, Тервел, Топола, Храброво, Челопечене, Шабла"
19.06.2019,"Абрит, Балчик, Добрич, Дуранкулак, Каварна, Кладенци, Крушари, Ломница, Победа, Пчеларово, Рогачево, Стожер, Тервел, Челопечене, Шабла"
18.06.2019,"Абрит, Балчик, Белгун, Гешаново, Горичане, Добрич, Житница, Каварна, Кладенци, Крушари, Ломница, Лясково, Одърци, Орляк, Свобода, Смолница, Стражица, Тервел, Шабла"
17.06.2019,"Абрит, Балчик, Батово, Било, Великово, Добрич, Каварна, Крушари, Нейково, Рогачево, Сърнец, Тервел, Шабла"
15.06.2019,"Добрич, Крагулево, Крушари, Тервел"
14.06.2019,"Балчик, Било, Гешаново, Добрево, Добрич, Каварна, Карвуна, Кладенци, Лясково, Нейково, Оброчище, Росица, Свобода, Стожер, Тервел, Тюленово, Шабла"
13.06.2019,"Бенковски, Божан, Воднянци, Гешаново, Добрич, Енево, Житница, Каварна, Крушари, Лясково, Медово, Могилище, Орляк, Пчелник, Сноп, Тервел"
12.06.2019,"Бенковски, Българево, Добрич, Долина, Енево, Каварна, Крагулево, Крушари, Лозенец, Лясково, Медово, Овчарово, Одринци, Паскалево, Северци, Сноп, Тюленово, Шабла"
11.06.2019,"Балчик, Бенковски, Бранище, Градини, Добрич, Долина, Енево, Златия, Каварна, Камен, Камен бряг, Кранево, Крушари, Лозенец, Малка Смолница, Медово, Паскалево, Победа, Смолница, Тюленово, Челопечене, Шабла"
10.06.2019,"Балик, Балчик, Батово, Било, Воднянци, Горичане, Добрич, Жегларци, Каварна, Карвуна, Кардам, Коларци, Рогачево, Тервел, Челопечене, Шабла"
07.06.2019,"Белгун, Владимирово, Добрич, Дъбовик, Каварна, Карапелит, Орляк, Стаевци, Тервел, Хаджи Димитър, Шабла"
06.06.2019,"Балик, Балчик, Безводица, Владимирово, Добрич, Каварна, Карапелит, Карвуна, Кардам, Кранево, Крушари, Нейково, Оброчище, Рогачево, Северняк, Смолница, Тервел, Топола, Шабла"
05.06.2019,"Балик, Балчик, Добрич, Дъбовик, Каварна, Камен, Камен бряг, Кладенци, Къпиново, Ловчанци, Оброчище, Овчарово, Пленимир, Присад, Равнец, Рогачево, Тервел, Шабла"
04.06.2019,"Балчик, Добрич, Каварна, Крушари, Лозенец, Спасово, Тервел, Черна, Шабла"
03.06.2019,"Балчик, Гешаново, Добрич, Каварна, Крушари, Победа, Стожер, Телериг, Тервел, Топола, Шабла"
02.06.2019,Добрич
01.06.2019,Добрич
31.05.2019,"Александрия, Безмер, Вранино, Гуслар, Добрич, Драганово, Дуранкулак, Каварна, Крушари, Лясково, Попгригорово, Пчелник, Стефаново, Тервел, Челопечене, Черна, Шабла"
30.05.2019,"Абрит, Балчик, Безводица, Вранино, Добрич, Драганово, Дуранкулак, Каварна, Крушари, Сенокос, Соколник, Соколово, Тервел, Топола, Шабла"
29.05.2019,"Абрит, Балик, Балчик, Батово, Вранино, Добрич, Драганово, Каварна, Крушари, Лозенец, Овчарово, Преселенци, Твърдица, Тервел, Тюленово, Шабла"
28.05.2019,"Абрит, Безмер, Божан, Гешаново, Горун, Добрич, Драганово, Каварна, Карапелит, Крушари, Овчарово, Твърдица, Тервел, Топола, Шабла"
27.05.2019,"Балчик, Видно, Гешаново, Горун, Добрич, Житен, Каварна, Пчеларово, Рогачево, Славеево, Твърдица, Тервел, Челопечене, Черна, Шабла"
25.05.2019,"Балик, Добрич"
23.05.2019,"Балчик, Владимирово, Гешаново, Добрич, Каварна, Крагулево, Крушари, Шабла"
22.05.2019,"Балчик, Българево, Владимирово, Добрич, Каварна, Карапелит, Крушари, Свобода, Северци, Стражица, Тервел, Шабла"
21.05.2019,"Балчик, Батово, Владимирово, Гешаново, Горичане, Добрич, Иречек, Каварна, Шабла"
20.05.2019,"Балчик, Гешаново, Горичане, Добрич, Каварна, Карапелит, Оброчище, Приморци, Шабла"
18.05.2019,"Владимирово, Добрич"
17.05.2019,"Балчик, Врачанци, Горичане, Добрич, Дончево, Иречек, Каварна, Карапелит, Орляк, Рогачево, Спасово, Тервел, Шабла"
16.05.2019,"Батово, Бенковски, Горичане, Добрич, Енево, Иречек, Каварна, Медово, Сливенци, Спасово, Тервел, Шабла"
15.05.2019,"Балик, Балчик, Брястово, Гешаново, Добрич, Каварна, Калина, Къпиново, Победа"
14.05.2019,"Балчик, Българево, Ведрина, Владимирово, Горичане, Добрич, Дропла, Дъбрава, Житен, Змеево, Каварна, Коларци, Кремена, Могилище, Орлова могила, Орляк, Пчелино, Сенокос, Тервел, Шабла"
13.05.2019,"Балчик, Ведрина, Добрич, Жегларци, Каварна, Красен, Могилище, Оброчище, Пчелино, Тервел, Шабла"
10.05.2019,"Балчик, Батово, Бенковски, Добрич, Каварна, Крушари, Оброчище, Одърци, Победа, Приморци, Тервел, Тюленово, Узово, Хитово, Шабла"
09.05.2019,"Бистрец, Ведрина, Горичане, Добрич, Каварна, Крушари, Септемврийци, Смолница, Шабла"
08.05.2019,"Балчик, Българево, Ведрина, Видно, Врачанци, Горичане, Градини, Добрич, Жегларци, Зърнево, Каварна, Оброчище, Соколово, Тервел, Черна, Шабла"
07.05.2019,"Балчик, Батово, Българево, Добрич, Каварна, Раковски, Църква"
05.05.2019,"Балчик, Добрич, Кранево, Крушари"
03.05.2019,"Балчик, Бежаново, Българево, Врачанци, Добрич, Каварна, Козлодуйци, Пролез, Смолница, Соколово, Царевец, Шабла"
02.05.2019,"Балик, Балчик, Батово, Горичане, Добрич, Каварна, Козлодуйци, Коларци, Крушари, Лясково, Методиево, Овчарово, Септемврийци, Спасово, Сърнец, Тервел, Хаджи Димитър, Шабла"
30.04.2019,"Балик, Балчик, Градница, Добрич, Дончево, Каварна, Кардам, Конаре, Тервел"
27.04.2019,"Добрич, Подслон"
26.04.2019,"Добрич, Кардам, Тервел"
25.04.2019,"Балик, Балчик, Българево, Добрич, Каварна, Методиево, Тригорци"
24.04.2019,"Балчик, Батово, Безводица, Добрич, Жегларци, Иречек, Каварна, Калина, Карапелит, Конаре, Крушари, Телериг, Тервел, Шабла"
23.04.2019,"Балчик, Дебрене, Добрич, Иречек, Каварна, Крушари, Пчеларово, Рогачево, Сенокос, Топола, Черна, Черноморци, Шабла"
22.04.2019,"Балчик, Безводица, Добрич, Каварна, Паскалево, Соколово, Тервел"
20.04.2019,Добрич
19.04.2019,"Бранище, Великово, Граничар, Добрич, Иречек, Каварна, Козлодуйци, Паскалево, Свобода, Шабла"
18.04.2019,"Балик, Балчик, Великово, Добрич, Изворово, Иречек, Каварна, Соколово"
17.04.2019,"Балик, Балчик, Батово, Градини, Добрич, Захари Стояново, Зърнево, Каварна, Карапелит, Кремена, Орлова могила, Приморци, Селце, Стожер, Тервел, Топола, Шабла"
16.04.2019,"Балик, Балчик, Добрин, Добрич, Дъбрава, Захари Стояново, Каварна, Кранево, Крушари, Раковски, Шабла"
15.04.2019,"Балик, Балчик, Горун, Гурково, Добрич, Каварна, Кладенци, Тервел, Шабла"
13.04.2019,"Добрич, Люляково, Орлова могила"
12.04.2019,"Балчик, Брястово, Добрич, Каварна, Кранево, Паскалево, Свобода, Хаджи Димитър, Шабла"
11.04.2019,"Балчик, Бранище, Гешаново, Горичане, Добрич, Иречек, Каварна, Крушари, Нова Камена, Подслон, Телериг, Тервел, Тригорци, Шабла"
10.04.2019,"Балчик, Воднянци, Граничар, Добрич, Каварна, Козлодуйци, Коритен, Кранево, Крушари, Пчелино, Свобода, Смолница, Тервел, Шабла"
09.04.2019,"Балчик, Василево, Добрич, Дончево, Драганово, Каварна, Конаре, Кранево, Крушари, Приморци, Пчеларово, Свобода, Телериг, Тервел"
08.04.2019,"Балчик, Видно, Добрич, Зимница, Каварна, Козлодуйци, Кранево, Крушари, Оброчище, Преселенци, Приморци, Раковски"
07.04.2019,Добрич
06.04.2019,"Балчик, Добрич, Кардам"
05.04.2019,"Балчик, Василево, Добрич, Дуранкулак, Каварна, Крушари, Росица, Соколник, Соколово, Тюленово, Шабла"
04.04.2019,"Балчик, Батово, Ведрина, Горичане, Граничар, Добрич, Зърнево, Козлодуйци, Кранево, Орляк, Росеново, Снягово, Тервел, Шабла"
03.04.2019,"Балчик, Бенковски, Великово, Добрич, Калина, Методиево, Орляк, Паскалево, Тервел, Шабла"
02.04.2019,"Добрич, Каварна, Карапелит, Крушари, Одърци, Орляк, Паскалево, Септемврийци, Смин, Тервел, Шабла"
01.04.2019,"Балчик, Бежаново, Вранино, Добрич, Дропла, Каварна, Опанец, Свобода, Селце, Шабла"
29.03.2019,"Балчик, Врачанци, Добрич, Драганово, Дропла, Дъбрава, Житен, Каварна, Крупен, Победа, Приморци, Сърнино, Царевец, Шабла"
28.03.2019,"Балчик, Бенковски, Вранино, Гешаново, Горун, Добрин, Добрич, Дъбрава, Каварна, Козлодуйци, Красен, Крушари, Одринци, Приморци, Пчелино, Славеево, Тервел, Честименско, Шабла"
27.03.2019,"Балчик, Безводица, Бенковски, Великово, Добрин, Добрич, Дропла, Езерец, Иречек, Каварна, Крушари, Малка Смолница, Медово, Орляк, Росеново, Смолница, Тервел, Царичино, Шабла"
26.03.2019,"Абрит, Безводица, Бобовец, Бранище, Добрево, Добрич, Каварна, Котленци, Крушари, Ломница, Ляхово, Методиево, Оброчище, Овчарово, Орлова могила, Орляк, Паскалево, Победа, Пролез, Свобода, Сливенци, Тервел, Храброво, Царевец, Шабла"
25.03.2019,"Балчик, Батово, Българево, Врачанци, Горун, Добрич, Житен, Златия, Каварна, Крушари, Могилище, Пчелино, Шабла"
24.03.2019,Добрич
23.03.2019,Добрич
22.03.2019,"Балик, Балчик, Българево, Добрич, Изворово, Иречек, Каварна, Одърци, Орляк, Рогачево, Росен, Смолница, Твърдица, Тервел, Тюленово, Шабла"
21.03.2019,"Абрит, Балчик, Добрич, Каварна, Нейково, Приморци, Пролез, Рогачево, Твърдица, Тервел, Шабла"
20.03.2019,"Абрит, Балчик, Батово, Божурец, Гешаново, Добрич, Дуранкулак, Каварна, Красен, Крушари, Методиево, Рогачево, Рогозина, Смолница, Тюленово, Шабла"
19.03.2019,"Балчик, Градини, Добрич, Каварна, Карапелит, Ловчанци, Нейково, Орляк, Победа, Рогачево, Сенокос, Тервел, Тюленово, Царевец, Шабла"
18.03.2019,"Балчик, Батово, Добрич, Каварна, Красен, Крушари, Пролез, Рогачево, Сенокос, Стефаново, Хитово, Шабла"
16.03.2019,Добрич
15.03.2019,"Балканци, Батово, Богдан, Добрич, Дончево, Дуранкулак, Загорци, Каварна, Конаре, Крушари, Ломница, Пчелино, Росица, Тригорци, Хаджи Димитър, Шабла"
14.03.2019,"Балчик, Батово, Добрич, Дуранкулак, Житен, Каварна, Карвуна, Свобода, Тервел, Чернооково, Шабла"
13.03.2019,"Балчик, Безводица, Горица, Добрич, Дуранкулак, Житен, Житница, Каварна, Козлодуйци, Крушари, Мали извор, Нейково, Росица, Стражица, Сърнец, Телериг, Тервел, Шабла"
12.03.2019,"Българево, Горица, Добрич, Житен, Златия, Каварна, Козлодуйци, Подслон, Пролез, Пчелино, Сливенци, Смолница, Шабла"
11.03.2019,"Балик, Балчик, Безводица, Безмер, Бенковски, Гурково, Добрич, Каварна, Кранево, Крушари, Нейково, Огражден, Пролез, Пчеларово, Тервел, Шабла"
09.03.2019,Добрич
08.03.2019,"Балик, Балчик, Гурково, Добрич, Каварна, Козлодуйци, Кочмар, Къпиново, Преселенци, Пролез, Самуилово, Тервел, Царевец, Шабла"
07.03.2019,"Балик, Балчик, Батово, Българево, Горун, Гурково, Добрич, Дуранкулак, Зограф, Иречек, Каварна, Кардам, Крушари, Ловчанци, Методиево, Поручик Кърджиево, Тервел, Шабла"
06.03.2019,"Балчик, Безмер, Добрич, Дропла, Иречек, Каварна, Карапелит, Козлодуйци, Крушари, Могилище, Орляк, Подслон, Пролез, Равнец, Соколово, Стожер, Тервел, Чернооково, Шабла"
05.03.2019,"Балик, Балчик, Батово, Българево, Добрич, Житен, Каварна, Одърци, Сенокос, Спасово, Стефан Караджа, Черноморци, Шабла"
04.03.2019,"Балчик, Дебрене, Добрич, Рогачево"
03.03.2019,"Добрич, Котленци"
02.03.2019,"Балчик, Добрич, Житен, Лясково, Рогачево"
01.03.2019,"Балканци, Балчик, Богдан, Добрич, Дончево, Драганово, Иречек, Каварна, Козлодуйци, Одърци, Опанец, Присад, Рогачево"
28.02.2019,"Балик, Балчик, Бежаново, Българево, Добрич, Житен, Зърнево, Иречек, Каварна, Козлодуйци, Крапец, Крушари, Приморци, Рогачево, Тервел, Шабла"
27.02.2019,"Балик, Балчик, Българево, Вранино, Добрич, Драганово, Каварна, Ловчанци, Мали извор, Рогачево, Тервел, Тюленово, Царевец, Шабла"
26.02.2019,"Балчик, Батово, Безмер, Българево, Горун, Добрич, Каварна, Крушари, Победа, Рогачево, Соколово, Твърдица, Тервел, Узово, Шабла"
25.02.2019,"Балчик, Батово, Българево, Владимирово, Добрич, Каварна, Крагулево, Крушари, Рогачево, Сенокос, Стефаново, Узово, Черна"
24.02.2019,"Владимирово, Добрич"
23.02.2019,"Балик, Добрич"
22.02.2019,"Балик, Балчик, Батово, Безводица, Гешаново, Гурково, Добрич, Дропла, Дъбрава, Змеево, Каварна, Крупен, Могилище, Оброчище, Приморци, Сенокос"
21.02.2019,"Балчик, Божан, Воднянци, Гурково, Добрево, Добрич, Каварна, Орлова могила, Пчеларово, Свобода, Тервел, Шабла"
20.02.2019,"Владимирово, Воднянци, Добрич, Житен, Каварна, Мали извор, Паскалево, Росеново, Свобода, Сираково, Стожер, Сърнец, Тервел, Челопечене, Шабла"
19.02.2019,"Балик, Воднянци, Добрич, Каварна, Кладенци, Козлодуйци, Крушари, Тервел, Челопечене, Шабла"
18.02.2019,"Алцек, Балчик, Безмер, Воднянци, Гурково, Добрич, Каварна, Крушари, Лозенец, Оброчище, Септемврийци, Тервел"
17.02.2019,Добрич
16.02.2019,"Добрич, Узово"
15.02.2019,"Видно, Добрич, Каварна, Смолница"
14.02.2019,"Балчик, Безмер, Било, Гурково, Добрич, Каварна, Орляк, Смолница, Спасово, Тервел"
13.02.2019,"Абрит, Балчик, Безмер, Било, Гурково, Добрин, Добрич, Каварна, Крушари, Паскалево, Смолница, Тервел"
12.02.2019,"Безмер, Воднянци, Добрич, Каварна, Паскалево, Сърнец, Тервел"
11.02.2019,"Безмер, Добрич, Каварна, Кардам, Крушари, Огняново, Паскалево, Свобода, Тервел"
09.02.2019,"Добрич, Котленци, Росеново"
08.02.2019,"Балчик, Батово, Ведрина, Войниково, Добрич, Каварна, Коритен, Котленци, Крушари, Ново Ботево, Сноп, Тервел, Царевец, Чернооково"
07.02.2019,"Балчик, Добрич, Каварна, Красен, Одърци, Септемврийци, Смолница, Спасово, Стожер, Топола, Чернооково"
06.02.2019,"Балчик, Бенковски, Бистрец, Видно, Гурково, Добрич, Дуранкулак, Каварна, Красен, Крушари, Методиево, Шабла"
05.02.2019,"Абрит, Балчик, Безмер, Бистрец, Видно, Владимирово, Добрич, Изворово, Каварна, Крушари, Ляхово, Победа, Тервел, Тюленово, Шабла"
04.02.2019,"Балчик, Добрич, Житен, Каварна, Кладенци, Котленци, Овчарово, Одърци, Орляк, Пролез, Рогачево, Тервел, Чернооково, Шабла"
03.02.2019,Добрич
02.02.2019,"Добрич, Оброчище, Росица"
01.02.2019,"Бежаново, Врачанци, Добрево, Добрич, Долина, Златия, Каварна, Козлодуйци, Крушари, Методиево, Оброчище, Овчарово, Одърци, Паскалево, Победа, Приморци, Росица, Свобода, Сливенци, Смолница, Сноп, Средина, Сърнец, Тервел, Топола, Царевец"
31.01.2019,"Балчик, Владимирово, Врачанци, Добрево, Добрич, Долина, Златия, Каварна, Козлодуйци, Крушари, Методиево, Оброчище, Овчарово, Одърци, Орлова могила, Паскалево, Победа, Приморци, Свобода, Сливенци, Смолница, Тервел, Царевец, Царичино"
30.01.2019,"Балчик, Градини, Добрич, Дъбовик, Кочмар, Къпиново, Люляково, Оброчище, Пленимир, Присад, Равнец, Соколово, Спасово, Сърнец, Тервел, Шабла"
29.01.2019,"Балчик, Безводица, Бранище, Великово, Добрич, Каварна, Кочмар, Крапец, Оброчище, Тервел, Църква, Шабла"
28.01.2019,"Балчик, Великово, Добрич, Каварна, Камен, Карапелит, Кранево, Крапец, Оброчище, Росица, Смолница, Сноп, Топола, Църква, Шабла"
27.01.2019,Добрич
26.01.2019,"Добрич, Оброчище"
25.01.2019,"Безводица, Белгун, Добрич, Каварна, Карапелит, Крапец, Росица, Черна, Шабла"
24.01.2019,"Белгун, Градини, Добрич, Житница, Каварна, Крушари, Рогозина, Свобода, Смолница, Тервел, Тюленово, Шабла"
23.01.2019,"Батово, Бранище, Горун, Добрич, Каварна, Миладиновци, Одърци, Росица, Септемврийци, Славеево, Смолница, Стефаново, Черна, Шабла"
22.01.2019,"Балчик, Добрич, Житница, Каварна, Ловчанци, Миладиновци, Оброчище, Орляк, Преселенци, Пчелино, Сенокос, Тервел, Шабла"
