date,places
14.08.2024,"Балчик, Безводица, Горун, Добрич, Дропла, Змеево, Зърнево, Каварна, Могилище, Сенокос, Сноп, Тервел, Шабла"
13.08.2024,"Балчик, Бдинци, Безводица, Владимирово, Вратарите, Врачанци, Добрич, Долина, Дропла, Златия, Змеево, Зърнево, Изворово, Каварна, Козлодуйци, Одринци, Орлова могила, Попгригорово, Рогачево, Самуилово, Сенокос, Спасово, Тервел"
12.08.2024,"Ангеларий, Балик, Балчик, Бдинци, Белгун, Владимирово, Вратарите, Врачанци, Граничар, Добрич, Долина, Дуранкулак, Златия, Каварна, Камен, Козлодуйци, Коларци, Овчарово, Одринци, Оногур, Орлова могила, Паскалево, Пчеларово, Рогачево, Самуилово, Твърдица, Тервел, Топола, Хаджи Димитър, Шабла"
10.08.2024,"Ангеларий, Балик, Добрич, Дъбовик, Зърнево, Каварна, Калина, Камен, Коларци, Пленимир, Присад, Равнец, Тервел, Топола"
09.08.2024,"Ангеларий, Балик, Балчик, Безводица, Добрич, Дончево, Дъбовик, Житница, Каварна, Калина, Коларци, Оногур, Пленимир, Спасово, Твърдица, Тервел"
08.08.2024,"Александрия, Балчик, Батово, Бистрец, Българево, Габер, Добрич, Дъбовик, Загорци, Земенци, Каварна, Коларци, Конаре, Кранево, Кремена, Крушари, Огняново, Одърци, Оногур, Плачидол, Пленимир, Попгригорово, Присад, Равнец, Селце, Соколник, Тервел, Топола"
07.08.2024,"Балчик, Бдинци, Брястово, Владимирово, Горун, Добрич, Каварна, Къпиново, Лясково, Подслон, Попгригорово, Раковски, Соколник, Тервел, Шабла"
06.08.2024,"Балчик, Безводица, Белгун, Божурово, Василево, Добрич, Дропла, Змеево, Зърнево, Каварна, Крушари, Лозенец, Ново Ботево, Опанец, Преселенци, Рогачево, Росеново, Сенокос, Тервел, Тянево, Храброво, Шабла"
05.08.2024,"Балчик, Граничар, Добрич, Дропла, Ефрейтор Бакалово, Змеево, Каварна, Крушари, Орляк, Пчелино, Стражица, Тервел, Хаджи Димитър, Шабла"
04.08.2024,"Ангеларий, Балик, Балчик, Белгун, Българево, Добрич, Дропла, Дъбовик, Змеево, Каварна, Коларци, Ново Ботево, Оногур, Пленимир, Присад, Равнец, Тервел, Царичино"
03.08.2024,"Балчик, Добрич, Дропла, Змеево, Зърнево, Приморци, Тервел"
02.08.2024,"Балчик, Безводица, Белгун, Ведрина, Добрич, Зърнево, Каварна, Крушари, Ново Ботево, Победа, Северняк, Тервел, Тригорци, Тянево, Царичино, Шабла"
01.08.2024,"Балчик, Войниково, Гешаново, Добрич, Дончево, Зърнево, Кранево, Крушари, Оброчище, Пленимир, Попгригорово, Сенокос, Тервел"
31.07.2024,"Абрит, Александрия, Балчик, Бистрец, Божурово, Габер, Горун, Добрич, Загорци, Земенци, Каварна, Калина, Камен, Камен бряг, Крушари, Миладиновци, Огняново, Северци, Тервел, Тюленово, Царичино, Шабла"
30.07.2024,"Александрия, Балчик, Батово, Бистрец, Бонево, Великово, Габер, Горун, Добрич, Загорци, Земенци, Каблешково, Каварна, Камен, Камен бряг, Крушари, Огняново, Пчеларово, Раковски, Сираково, Соколово, Стожер, Тервел, Тюленово, Хаджи Димитър, Черноморци, Честименско, Шабла"
29.07.2024,"Балчик, Батово, Безмер, Добрич, Ефрейтор Бакалово, Житен, Каварна, Камен, Камен бряг, Коларци, Крушари, Раковски, Самуилово, Смолница, Спасово, Тервел, Царичино, Шабла"
27.07.2024,"Божаново, Добрич, Шабла"
26.07.2024,"Балчик, Великово, Вранино, Гешаново, Гурково, Добрич, Дропла, Зърнево, Каварна, Карапелит, Котленци, Крупен, Малка Смолница, Орляк, Подслон, Смолница, Тервел"
25.07.2024,"Александрия, Балчик, Батово, Бистрец, Божаново, Габер, Гешаново, Добрич, Загорци, Земенци, Зърнево, Каварна, Карапелит, Крупен, Крушари, Ловчанци, Миладиновци, Нейково, Оброчище, Огняново, Одърци, Орляк, Подслон, Поручик Кърджиево, Северци, Славеево, Соколник, Стефаново, Твърдица, Тервел, Узово, Храброво, Шабла"
24.07.2024,"Александрия, Бистрец, Габер, Добрич, Загорци, Земенци, Изворово, Каварна, Крупен, Крушари, Къпиново, Ловчанци, Миладиновци, Огняново, Победа, Смолница, Снягово, Стефаново"
23.07.2024,"Александрия, Балчик, Бистрец, Божаново, Воднянци, Габер, Добрево, Добрич, Загорци, Земенци, Каварна, Котленци, Кочмар, Крупен, Крушари, Ловчанци, Ломница, Миладиновци, Овчарово, Огняново, Паскалево, Победа, Сенокос, Сираково, Сливенци, Стефан Караджа, Тервел, Топола, Узово, Царевец, Шабла"
22.07.2024,"Александрия, Балчик, Бистрец, Божурово, Габер, Горичане, Горун, Градини, Добрево, Добрич, Дропла, Житен, Загорци, Земенци, Зимница, Зограф, Каварна, Кладенци, Котленци, Крупен, Крушари, Ловчанци, Ломница, Люляково, Миладиновци, Оброчище, Овчарово, Огняново, Паскалево, Победа, Пчеларово, Росеново, Сираково, Сливенци, Сноп, Стефан Караджа, Телериг, Тервел, Узово, Царевец, Шабла"
21.07.2024,"Балчик, Великово, Добрич, Каварна, Кранево, Крушари, Телериг"
20.07.2024,"Балчик, Българево, Владимирово, Врачанци, Добрич, Земенци, Каварна, Козлодуйци, Кранево, Крушари, Ново Ботево, Твърдица, Телериг"
19.07.2024,"Алцек, Балчик, Божаново, Воднянци, Вранино, Градини, Дебрене, Добрич, Дончево, Дропла, Жегларци, Житен, Земенци, Змеево, Зограф, Зърнево, Каварна, Калина, Кранево, Кремена, Крушари, Къпиново, Лясково, Ново Ботево, Оброчище, Паскалево, Пчеларово, Раковски, Рогачево, Северняк, Сенокос, Сноп, Стожер, Тервел, Тюленово, Узово, Хаджи Димитър, Хитово, Шабла"
18.07.2024,"Балчик, Божаново, Габер, Градини, Добрич, Дропла, Житен, Змеево, Зограф, Изворово, Каварна, Калина, Кладенци, Крушари, Малка Смолница, Овчарово, Пчеларово, Сенокос, Смолница, Сноп, Стефаново, Тервел, Узово, Шабла"
17.07.2024,"Балчик, Батово, Воднянци, Вранино, Врачанци, Добрево, Добрич, Долина, Дропла, Житен, Златия, Змеево, Каварна, Козлодуйци, Кремена, Крушари, Къпиново, Ломница, Люляково, Овчарово, Писарово, Пчелино, Свобода, Северци, Сенокос, Славеево, Сливенци, Твърдица, Царевец"
16.07.2024,"Балчик, Батово, Великово, Видно, Дебрене, Добрево, Добрич, Зимница, Изворово, Каварна, Калина, Кочмар, Крушари, Ломница, Люляково, Малина, Миладиновци, Оброчище, Овчарово, Писарово, Свобода, Северци, Сливенци, Тервел, Царевец"
15.07.2024,"Балчик, Бенковски, Богдан, Великово, Воднянци, Габер, Добрич, Житница, Каварна, Крушари, Къпиново, Лозенец, Люляково, Лясково, Малина, Малка Смолница, Оброчище, Паскалево, Рогачево, Смолница, Соколово, Твърдица, Тервел, Тригорци, Шабла"
14.07.2024,"Балчик, Габер, Добрич, Дропла, Змеево, Крушари, Рогачево, Сенокос, Стефаново"
13.07.2024,"Балик, Балчик, Добрич, Каварна, Орляк, Росен, Сенокос, Стефан Караджа, Стефаново, Стожер, Тервел, Тригорци"
12.07.2024,"Балчик, Бенковски, Добрич, Дончево, Драганово, Загорци, Кочмар, Краище, Крапец, Крушари, Къпиново, Опанец, Приморци, Стефаново, Стожер, Тервел, Шабла"
11.07.2024,"Александрия, Балчик, Великово, Горун, Добрево, Добрич, Дончево, Житница, Кочмар, Крушари, Лозенец, Малка Смолница, Пленимир, Пчелино, Славеево, Смолница, Спасово, Стефаново, Твърдица, Тервел, Шабла"
10.07.2024,"Балчик, Воднянци, Гешаново, Добрич, Житен, Каварна, Карапелит, Коларци, Кочмар, Крушари, Малка Смолница, Опанец, Паскалево, Подслон, Пчелино, Смолница, Спасово, Тервел, Черна"
09.07.2024,"Балчик, Вранино, Добрич, Каварна, Крушари, Лозенец, Малка Смолница, Орляк, Сливенци, Смолница, Соколово, Спасово, Тервел, Чернооково"
08.07.2024,"Балчик, Добрич, Житен, Каварна, Крушари, Могилище, Попгруево, Раковски, Сърнец, Тервел, Шабла"
07.07.2024,"Балчик, Добрич, Соколово, Шабла"
06.07.2024,"Добрич, Каварна, Стефаново, Топола"
05.07.2024,"Балчик, Горун, Добрич, Долина, Зимница, Каварна, Кладенци, Крушари, Къпиново, Нейково, Орлова могила, Пчелино, Раковски, Славеево, Соколово, Спасово, Тервел, Топола, Шабла"
04.07.2024,"Балчик, Вранино, Врачанци, Добрич, Змеево, Каварна, Козлодуйци, Коритен, Крушари, Методиево, Орлова могила, Тервел, Тянево, Шабла"
03.07.2024,"Абрит, Балик, Балчик, Вранино, Врачанци, Добрич, Каварна, Камен, Козлодуйци, Крушари, Лясково, Орляк, Пленимир, Росица, Свобода, Тервел, Царичино, Шабла"
02.07.2024,"Балик, Балчик, Бенковски, Врачанци, Добрич, Драганово, Дуранкулак, Изворово, Каварна, Козлодуйци, Крушари, Ловчанци, Методиево, Орляк, Рогозина, Росен, Спасово, Тервел, Топола, Шабла"
01.07.2024,"Балчик, Ваклино, Вранино, Врачанци, Горун, Добрич, Долина, Златия, Каварна, Крушари, Малка Смолница, Методиево, Пчеларово, Раковски, Рогачево, Росен, Северци, Смолница, Спасово, Тервел, Хаджи Димитър, Челопечене, Шабла"
30.06.2024,"Врачанци, Добрич, Изворово, Козлодуйци, Узово"
29.06.2024,"Балчик, Генерал Тошево, Добрич, Ефрейтор Бакалово, Крушари"
28.06.2024,"Абрит, Балчик, Безводица, Воднянци, Гешаново, Гурково, Добрич, Каварна, Крушари, Соколово, Спасово, Тервел, Църква, Челопечене"
27.06.2024,"Балчик, Безмер, Видно, Владимирово, Воднянци, Вранино, Врачанци, Горичане, Горун, Гурково, Добрич, Дъбовик, Иречек, Каварна, Камен, Камен бряг, Люляково, Орляк, Поручик Чунчево, Пролез, Свобода, Твърдица, Тервел, Челопечене, Шабла"
26.06.2024,"Балчик, Безводица, Видно, Вранино, Врачанци, Горичане, Гурково, Дебрене, Добрич, Иречек, Каварна, Кладенци, Козлодуйци, Коларци, Ловчанци, Малка Смолница, Миладиновци, Орляк, Паскалево, Пролез, Смолница, Сноп, Твърдица, Тервел, Хитово, Челопечене, Шабла"
25.06.2024,"Балик, Балчик, Бежаново, Гешаново, Добрич, Йовково, Каварна, Кранево, Крушари, Овчарово, Полковник Дяково, Приморци, Стражица, Твърдица, Тервел, Шабла"
24.06.2024,"Балчик, Батово, Божаново, Великово, Владимирово, Габер, Добрич, Каварна, Камен, Крушари, Огняново, Стожер, Тервел, Хитово, Царичино, Църква, Шабла"
23.06.2024,"Балчик, Габер, Дебрене, Добрич, Крушари"
22.06.2024,"Алцек, Воднянци, Дебрене, Добрич, Калина, Камен, Крапец, Лясково, Хитово, Шабла"
21.06.2024,"Александрия, Безводица, Божурово, Добрич, Долина, Дончево, Житница, Каварна, Кочмар, Крушари, Росеново, Тервел, Шабла"
20.06.2024,"Богдан, Божурово, Бонево, Войниково, Добрич, Дончево, Драганово, Каблешково, Каварна, Карапелит, Крушари, Нейково, Опанец, Поручик Кърджиево, Росеново, Тервел"
19.06.2024,"Балчик, Ведрина, Видно, Воднянци, Добрич, Драганово, Йовково, Каварна, Крушари, Нова Камена, Оброчище, Пчеларово, Пчелино, Телериг, Тервел, Тянево, Шабла"
18.06.2024,"Балчик, Божаново, Бранище, Врачанци, Добрич, Каварна, Козлодуйци, Крушари, Ловчанци, Ляхово, Миладиновци, Оброчище, Пленимир, Твърдица, Тервел, Шабла"
17.06.2024,"Балчик, Добрич, Каварна, Крушари, Люляково, Нейково, Одринци, Подслон, Пчелино, Сноп, Твърдица, Тянево, Черноморци, Шабла"
16.06.2024,"Балчик, Добрич, Дончево, Кранево"
15.06.2024,"Добрич, Котленци, Кочмар, Тервел"
14.06.2024,"Балчик, Белгун, Богдан, Добрич, Дропла, Каблешково, Каварна, Карапелит, Котленци, Могилище, Сноп, Стожер, Тервел"
13.06.2024,"Балчик, Безводица, Богдан, Великово, Градини, Добрич, Дончево, Драганово, Коритен, Котленци, Крушари, Люляково, Опанец, Сенокос, Славеево, Смолница, Тервел, Хитово, Чернооково"
12.06.2024,"Балчик, Българево, Войниково, Врачанци, Добрич, Драганово, Дъбовик, Каварна, Коларци, Крушари, Люляково, Орляк, Соколово, Тервел, Хитово, Шабла"
11.06.2024,"Балчик, Българево, Гурково, Добрево, Добрич, Дъбовик, Каварна, Крушари, Къпиново, Ломница, Овчарово, Одринци, Пленимир, Присад, Равнец, Раковски, Свобода, Северняк, Хаджи Димитър, Царевец, Чернооково, Шабла"
10.06.2024,"Александрия, Балчик, Ведрина, Добрич, Каварна, Крушари, Одринци, Победа, Росица, Тервел, Тригорци, Хаджи Димитър, Шабла"
08.06.2024,"Воднянци, Добрич"
07.06.2024,"Александрия, Балчик, Божурово, Великово, Дебрене, Добрич, Каварна, Кладенци, Крушари, Ловчанци, Поручик Чунчево, Телериг, Тервел, Тюленово, Шабла"
06.06.2024,"Балчик, Безводица, Божурец, Божурово, Градини, Добрич, Зимница, Каварна, Камен, Крагулево, Крушари, Лясково, Орляк, Паскалево, Плачидол, Победа, Росеново, Сенокос, Стефан Караджа, Телериг, Тервел, Топола, Царевец"
05.06.2024,"Балчик, Божурово, Добрич, Ефрейтор Бакалово, Зимница, Каварна, Крушари, Ловчанци, Лозница, Орляк, Поручик Чунчево, Росеново, Спасово, Телериг, Тервел"
04.06.2024,"Балчик, Божурово, Великово, Видно, Дебрене, Добрич, Каварна, Красен, Крушари, Лозенец, Оброчище, Росеново, Северци"
03.06.2024,"Балчик, Българево, Владимирово, Добрич, Дропла, Жегларци, Зимница, Йовково, Каварна, Калина, Красен, Крушари, Оброчище, Славеево, Твърдица, Телериг, Тервел, Шабла"
02.06.2024,Добрич
01.06.2024,"Добрич, Пленимир"
31.05.2024,"Балчик, Великово, Горичане, Добрич, Жегларци, Зърнево, Йовково, Кранево, Лозенец, Сноп, Соколово, Тервел, Шабла"
30.05.2024,"Балчик, Добрич, Житен, Змеево, Крушари, Победа, Рогачево, Северняк, Царичино, Шабла"
29.05.2024,"Балчик, Бранище, Добрич, Кладенци, Малка Смолница, Оброчище, Плачидол, Рогозина, Сираково, Смин, Смолница, Тервел, Шабла"
28.05.2024,"Безводица, Габер, Горун, Добрич, Дропла, Дъбрава, Житен, Змеево, Каварна, Капитан Димитрово, Карвуна, Кочмар, Кремена, Крушари, Ляхово, Оброчище, Плачидол, Сенокос, Септемврийци, Славеево, Спасово, Тервел, Храброво, Шабла"
27.05.2024,"Балчик, Великово, Владимирово, Добрич, Йовково, Каварна, Коритен, Кранево, Крушари, Лозенец, Пчеларово, Северци, Септемврийци, Шабла"
26.05.2024,"Дебрене, Добрич, Средина"
25.05.2024,"Балчик, Гурково, Добрич, Зърнево, Крушари, Лозенец, Северци, Тервел"
23.05.2024,"Бежаново, Дебрене, Добрич, Зърнево, Каварна, Камен, Камен бряг, Кочмар, Тервел, Тюленово, Шабла"
22.05.2024,"Балчик, Божурово, Дебрене, Добрич, Житен, Каварна, Кранево, Могилище, Оброчище, Рогачево, Църква"
21.05.2024,"Балчик, Ведрина, Добрич, Каварна, Коритен, Крушари, Раковски, Северняк, Тервел, Тянево, Храброво"
20.05.2024,"Балчик, Бенковски, Добрич, Карапелит, Красен, Крушари, Ломница, Малка Смолница, Рогачево, Северци, Смолница, Спасово, Твърдица, Тервел"
19.05.2024,"Добрич, Каварна, Крушари, Лозенец, Раковски, Северци"
18.05.2024,"Добрич, Каварна, Козлодуйци, Раковски"
17.05.2024,"Балчик, Добрич, Каварна, Крушари, Лозенец, Малка Смолница, Северци, Смолница, Узово, Църква"
16.05.2024,"Балканци, Балчик, Генерал Тошево, Дебрене, Добрич, Каварна, Кладенци, Крагулево, Красен, Крушари, Лозенец, Нова Камена, Паскалево, Северци, Соколово, Тервел, Топола, Тянево"
15.05.2024,"Балканци, Балчик, Добрич, Загорци, Каварна, Кладенци, Конаре, Красен, Крушари, Ловчанци, Лозенец, Мали извор, Миладиновци, Победа, Рогачево, Северци, Тервел"
14.05.2024,"Балчик, Безмер, Ведрина, Добрин, Добрич, Каварна, Козлодуйци, Кранево, Крушари, Лозенец, Овчарово, Северци, Спасово, Тервел, Храброво, Шабла"
13.05.2024,"Балик, Балчик, Дебрене, Добрич, Драганово, Зограф, Каварна, Крагулево, Крушари, Ловчанци, Лозенец, Малка Смолница, Миладиновци, Овчарово, Северци, Смолница, Соколово, Стефаново, Тервел, Топола"
12.05.2024,"Божурец, Добрич, Дончево, Каварна, Топола"
11.05.2024,"Божурец, Гешаново, Добрич, Каварна, Топола, Тюленово, Шабла"
10.05.2024,"Балчик, Безводица, Добрич, Драганово, Загорци, Каварна, Кранево, Крушари, Лозенец, Северци, Стефаново, Шабла"
09.05.2024,"Балчик, Великово, Вичово, Добрич, Каварна, Калина, Рогачево, Смолница, Стефаново, Шабла"
08.05.2024,"Балчик, Бобовец, Вичово, Добрич, Каварна, Карапелит, Крушари, Лозенец, Подслон, Рогачево, Северци, Соколово, Стражица, Тервел"
07.05.2024,"Балчик, Батово, Бежаново, Владимирово, Добрич, Каварна, Крушари, Ловчанци, Лозенец, Миладиновци, Одърци, Поручик Чунчево, Пчелино, Рогачево, Северци, Славеево, Сноп, Спасово, Сърнец, Тервел, Шабла"
06.05.2024,"Балчик, Добрич, Крушари, Ловчанци, Лозенец, Миладиновци, Рогачево, Северци"
05.05.2024,"Добрич, Крушари, Ловчанци, Лозенец, Миладиновци, Северци"
04.05.2024,"Генерал Тошево, Добрич, Крушари, Ловчанци, Лозенец, Миладиновци, Северци"
