date,places
29.03.2021,"Балчик, Батово, Бдинци, Бенковски, Било, Владимирово, Вратарите, Гурково, Добрич, Зърнево, Каварна, Кардам, Кладенци, Ловчанци, Лозница, Миладиновци, Орлова могила, Самуилово, Свобода, Тервел, Шабла"
28.03.2021,"Бдинци, Безводица, Владимирово, Вратарите, Добрич, Кардам, Ловчанци, Миладиновци, Орлова могила, Самуилово"
27.03.2021,"Балик, Добрич, Каблешково, Ловчанци, Миладиновци, Тервел"
26.03.2021,"Балчик, Бенковски, Бранище, Българево, Владимирово, Гуслар, Добрич, Каварна, Кардам, Ловчанци, Миладиновци, Спасово, Тервел, Узово, Шабла"
25.03.2021,"Балик, Балчик, Българево, Василево, Ведрина, Горица, Добрич, Каварна, Камен, Карапелит, Кардам, Крушари, Нейково, Шабла"
24.03.2021,"Балик, Балчик, Василево, Ведрина, Великово, Градини, Добрево, Добрич, Дропла, Каварна, Красен, Крупен, Овчарово, Одърци, Средина, Шабла"
23.03.2021,"Балчик, Бенковски, Добрич, Зограф, Изворово, Стефан Караджа"
22.03.2021,"Балчик, Безмер, Добрич, Енево, Одринци, Сенокос, Тервел, Шабла"
19.03.2021,"Балчик, Добрич, Змеево, Каварна, Котленци, Ломница, Тервел"
18.03.2021,"Балчик, Добрево, Добрич, Драганово, Змеево, Каварна, Паскалево, Победа, Пчеларово, Росеново, Царевец, Черна"
17.03.2021,"Балчик, Българево, Гешаново, Дебрене, Добрич, Драганово, Каварна, Методиево, Паскалево, Шабла"
16.03.2021,"Балчик, Бежаново, Българево, Ведрина, Дебрене, Добрево, Добрич, Зограф, Каварна, Котленци, Крагулево, Ломница, Ляхово, Методиево, Ново Ботево, Оброчище, Овчарово, Паскалево, Победа, Рогачево, Свобода, Сливенци, Смолница, Храброво, Царевец, Шабла"
15.03.2021,"Балик, Балчик, Добрич, Дропла, Дъбовик, Дъбрава, Змеево, Зограф, Каварна, Методиево, Одринци, Подслон, Пролез, Пчеларово, Северци, Сенокос, Шабла"
14.03.2021,"Балчик, Добрич, Дропла, Дъбрава, Змеево, Сенокос"
13.03.2021,"Добрич, Красен"
12.03.2021,"Балчик, Гешаново, Добрич, Каварна, Карапелит, Методиево, Подслон, Пчеларово, Рогачево, Свобода, Шабла"
11.03.2021,"Балчик, Българево, Гешаново, Добрич, Каварна, Карапелит, Подслон, Росеново, Тюленово, Шабла"
10.03.2021,"Балик, Балчик, Божан, Гешаново, Добрич, Каварна, Карапелит, Крагулево, Орляк, Подслон, Свобода, Спасово, Стражица, Тервел, Хаджи Димитър, Шабла"
09.03.2021,"Балик, Балчик, Българево, Добрич, Дъбрава, Каварна, Крушари, Подслон, Рогачево, Свобода, Сенокос, Средина, Тервел, Черна"
08.03.2021,"Балик, Балчик, Батово, Вичово, Градини, Добрич, Дропла, Житен, Житница, Каварна, Кочмар, Крапец, Крушари, Ловчанци, Смин, Сноп, Тервел, Узово, Шабла"
06.03.2021,"Балик, Добрич, Черноморци, Шабла"
05.03.2021,"Балик, Балчик, Божаново, Владимирово, Добрич, Каварна, Камен, Карапелит, Красен, Ловчанци, Орляк, Пролез, Стражица, Тервел, Шабла"
04.03.2021,"Балчик, Великово, Вратарите, Добрич, Дъбрава, Каварна, Кардам, Паскалево, Росица, Самуилово, Сноп, Тервел"
03.03.2021,"Българево, Добрич, Каварна, Сноп"
02.03.2021,"Балчик, Гурково, Добрич, Земенци, Каварна, Кранево, Крушари, Лясково, Огражден, Пролез, Росица, Самуилово, Славеево, Тервел, Тюленово, Шабла"
01.03.2021,"Абрит, Балчик, Българево, Великово, Горичане, Гурково, Добрич, Каварна, Карапелит, Крагулево, Крушари, Пролез, Пчелник, Самуилово, Узово, Шабла"
27.02.2021,"Добрич, Карапелит, Подслон, Пролез, Шабла"
26.02.2021,"Балчик, Владимирово, Гурково, Добрич, Зърнево, Каварна, Крушари, Орляк, Пролез, Селце, Смолница, Тервел, Честименско, Шабла"
25.02.2021,"Балчик, Добрич, Дъбрава, Каварна, Котленци, Крушари, Пролез, Шабла"
24.02.2021,"Абрит, Балчик, Василево, Гешаново, Градница, Гурково, Добрич, Дропла, Дъбрава, Змеево, Зърнево, Каварна, Кардам, Конаре, Кремена, Крупен, Крушари, Одринци, Орляк, Победа, Селце, Сенокос, Соколово, Тервел, Тригорци, Тюленово, Узово, Царичино, Шабла"
23.02.2021,"Балчик, Било, Бонево, Ваклино, Владимирово, Гурково, Добрич, Зимница, Каварна, Кочмар, Красен, Крушари, Ломница, Нова Камена, Росица, Тервел, Черна, Честименско, Шабла"
22.02.2021,"Балканци, Балчик, Безмер, Било, Добрич, Каварна, Калина, Кранево, Красен, Кремена, Одринци, Тервел, Тюленово, Царевец, Черна, Шабла"
21.02.2021,"Бдинци, Владимирово, Вратарите, Добрич, Орлова могила, Самуилово"
20.02.2021,"Балканци, Ваклино, Добрич, Котленци, Орляк, Пчеларово, Сноп, Тервел, Шабла"
19.02.2021,"Александрия, Балчик, Бистрец, Габер, Горун, Добрич, Жегларци, Загорци, Земенци, Котленци, Крушари, Ловчанци, Ново Ботево, Огняново, Орляк, Рогачево, Тервел, Тянево, Шабла"
18.02.2021,"Александрия, Балчик, Безмер, Бистрец, Божурец, Габер, Добрич, Загорци, Земенци, Каварна, Камен, Крупен, Крушари, Ловчанци, Огняново, Сенокос, Смолница, Стожер, Тервел, Шабла"
17.02.2021,"Балканци, Балчик, Батово, Бранище, Видно, Добрин, Добрич, Каварна, Кремена, Крушари, Паскалево, Пленимир, Полковник Свещарово, Тервел, Тянево, Шабла"
16.02.2021,"Алцек, Балчик, Безмер, Добрич, Драганово, Каварна, Самуилово, Северци, Сенокос, Спасово, Тервел, Шабла"
15.02.2021,"Балканци, Балчик, Великово, Владимирово, Воднянци, Граничар, Добрич, Каварна, Паскалево, Раковски, Тервел, Тригорци, Шабла"
12.02.2021,"Алцек, Видно, Врачанци, Добрич, Дончево, Каварна, Овчарово, Тянево, Царевец"
11.02.2021,"Балик, Балканци, Балчик, Видно, Врачанци, Добрич, Долина, Дуранкулак, Златия, Каварна, Козлодуйци, Малка Смолница, Ново Ботево, Оброчище, Орляк, Пчеларово, Рогачево, Свети Никола, Смолница, Сноп, Тервел, Тянево, Царевец, Шабла"
10.02.2021,"Балчик, Владимирово, Добрич, Карапелит, Котленци, Рогачево, Тервел, Шабла"
09.02.2021,"Александрия, Балчик, Било, Бобовец, Владимирово, Градини, Добрич, Дуранкулак, Жегларци, Житница, Каварна, Кардам, Крушари, Нейково, Славеево, Спасово, Стефан Караджа, Тервел, Шабла"
08.02.2021,"Балик, Балчик, Безводица, Бобовец, Ведрина, Великово, Горун, Добрич, Долина, Дуранкулак, Каварна, Камен, Кардам, Крушари, Паскалево, Самуилово, Северци, Спасово, Стражица, Тервел, Шабла"
07.02.2021,"Добрич, Тервел"
06.02.2021,"Добрич, Дуранкулак, Самуилово, Шабла"
05.02.2021,"Абрит, Балчик, Бобовец, Богдан, Великово, Горица, Горичане, Добрич, Змеево, Котленци, Крагулево, Крушари, Полковник Минково, Преселенци, Преспа, Стражица, Тервел, Царичино, Шабла"
04.02.2021,"Балчик, Богдан, Бранище, Видно, Вранино, Градини, Добрич, Дъбовик, Каварна, Котленци, Крагулево, Тервел"
03.02.2021,"Балчик, Видно, Вранино, Гурково, Добрин, Добрич, Изворово, Каварна, Карапелит, Конаре, Котленци, Крушари, Паскалево, Тервел, Тюленово, Шабла"
02.02.2021,"Балчик, Василево, Вранино, Гешаново, Гурково, Добрин, Добрич, Дончево, Каварна, Котленци, Крупен, Крушари, Миладиновци, Нова Камена, Попгруево, Сноп, Тервел, Църква"
01.02.2021,"Балчик, Богдан, Гурково, Добрич, Дропла, Каварна, Котленци, Крупен, Крушари, Лясково, Приморци, Пролез, Шабла"
31.01.2021,"Балчик, Добрич, Пролез, Царичино, Шабла"
30.01.2021,"Безводица, Добрич, Карапелит"
29.01.2021,"Балчик, Добрево, Добрич, Дропла, Дъбрава, Житница, Змеево, Котленци, Кремена, Преспа, Сенокос, Тервел"
28.01.2021,"Балканци, Балчик, Батово, Бранище, Врачанци, Горун, Гурково, Добрич, Долина, Дропла, Дъбрава, Златия, Змеево, Каварна, Камен, Камен бряг, Козлодуйци, Конаре, Кремена, Миладиновци, Одърци, Приморци, Пчелино, Раковски, Сенокос, Славеево, Соколник, Стефаново, Тригорци, Тюленово, Хаджи Димитър, Шабла"
27.01.2021,"Балчик, Батово, Бранище, Великово, Гурково, Добрич, Дропла, Дъбрава, Конаре, Кремена, Одърци, Преспа, Пчелино, Сенокос, Славеево, Стефаново, Тригорци"
26.01.2021,"Балчик, Бежаново, Бенковски, Ведрина, Добрич, Каварна, Крушари, Оброчище, Приморци, Рогозина, Свети Никола"
25.01.2021,"Балчик, Бенковски, Богдан, Вранино, Добрич, Долина, Езерец, Изворово, Каварна, Опанец, Приморци, Самуилово, Славеево, Соколово, Тервел, Челопечене, Шабла"
24.01.2021,"Балик, Балчик, Добрич, Приморци, Тервел"
23.01.2021,"Владимирово, Добрич"
22.01.2021,"Александрия, Безводица, Белгун, Великово, Видно, Владимирово, Добрич, Драганово, Изворово, Каварна, Калина, Коларци, Красен, Крушари, Одринци, Приморци, Спасово, Тервел, Шабла"
21.01.2021,"Балканци, Балчик, Божурово, Владимирово, Добрич, Езерец, Каварна, Конаре, Коритен, Крушари, Ново Ботево, Овчарово, Росеново, Септемврийци, Хаджи Димитър, Шабла"
20.01.2021,"Балчик, Белгун, Божурово, Ведрина, Великово, Градини, Гурково, Добрич, Дропла, Дуранкулак, Дъбрава, Каварна, Кардам, Крушари, Ново Ботево, Оброчище, Приморци, Росеново, Сенокос, Септемврийци, Сноп, Соколово, Тервел, Царичино, Шабла"
19.01.2021,"Ангеларий, Балик, Балканци, Балчик, Ведрина, Великово, Добрич, Езерец, Каварна, Коларци, Конаре, Нейково, Ново Ботево, Овчарово, Оногур, Писарово, Спасово, Тервел, Шабла"
18.01.2021,"Балчик, Владимирово, Вранино, Добрич, Дончево, Зърнево, Каварна, Карапелит, Кардам, Оброчище, Пленимир, Приморци, Пролез, Рогачево, Тервел, Шабла"
17.01.2021,"Ведрина, Добрич"
16.01.2021,"Балчик, Василево, Горун, Гурково, Добрич, Шабла"
15.01.2021,"Балчик, Бежаново, Ведрина, Градини, Добрич, Дончево, Каварна, Крушари, Методиево, Свети Никола, Телериг, Тервел, Царичино"
14.01.2021,"Абрит, Балчик, Ведрина, Дебрене, Добрич, Драганово, Каварна, Камен, Камен бряг, Крушари, Люляково, Нейково, Сърнец, Тервел, Шабла"
13.01.2021,"Балчик, Батово, Бежаново, Бранище, Василево, Ведрина, Гурково, Добрич, Драганово, Каварна, Калина, Одърци, Писарово, Приморци, Пчелино, Славеево, Смин, Стефаново, Шабла"
12.01.2021,"Батово, Бежаново, Бранище, Добрич, Каварна, Одърци, Опанец, Паскалево, Приморци, Пчелино, Славеево, Стефаново, Тервел, Хаджи Димитър"
11.01.2021,"Балчик, Белгун, Горичане, Горун, Добрич, Каварна, Овчарово, Опанец, Рогачево, Тервел, Шабла"
09.01.2021,"Бонево, Добрич, Кочмар, Тервел, Честименско"
08.01.2021,"Балчик, Бистрец, Добрич, Каварна, Крушари, Ловчанци, Одринци, Паскалево, Тервел"
07.01.2021,"Балчик, Бистрец, Добрич, Драганово, Езерец, Каварна, Карапелит, Кочмар, Крушари, Лозенец, Нейково, Пчелник, Септемврийци, Стефаново, Тервел, Шабла"
06.01.2021,"Балчик, Батово, Горун, Добрич, Драганово, Каварна, Карапелит, Кладенци, Кочмар, Крушари, Ловчанци, Оброчище, Писарово, Плачидол, Преселенци, Пчеларово, Септемврийци, Телериг, Тервел, Тригорци, Църква, Шабла"
05.01.2021,"Алцек, Балчик, Ведрина, Добрич, Жегларци, Каварна, Калина, Крушари, Ловчанци, Малка Смолница, Преселенци, Пчеларово, Смолница, Тервел, Тригорци, Шабла"
04.01.2021,"Балчик, Белгун, Бенковски, Великово, Добрич, Каварна, Калина, Преселенци, Пчелино, Средина, Стожер, Стражица, Шабла"
03.01.2021,Добрич
31.12.2020,"Балчик, Добрич, Каварна, Кранево, Красен, Крушари, Самуилово, Стражица"
30.12.2020,"Балчик, Гешаново, Добрич, Зограф, Каварна, Коритен, Крушари, Паскалево, Росеново, Свобода, Селце, Узово, Шабла"
29.12.2020,"Балчик, Богдан, Добрич, Каварна, Камен, Камен бряг, Медово, Ново Ботево, Царичино"
27.12.2020,"Балчик, Безводица, Добрич"
26.12.2020,"Балчик, Безводица, Добрич, Пчелино"
25.12.2020,"Добрич, Пчелино"
24.12.2020,"Балчик, Владимирово, Добрич, Оброчище"
23.12.2020,"Балчик, Богдан, Ведрина, Добрич, Дъбовик, Житница, Каварна, Крушари, Ловчанци, Селце, Смолница, Спасово, Телериг, Тервел, Шабла"
22.12.2020,"Алцек, Балчик, Божурово, Ведрина, Вранино, Врачанци, Градини, Добрич, Дропла, Зимница, Златия, Каварна, Козлодуйци, Кранево, Крушари, Плачидол, Приморци, Телериг, Хитово, Шабла"
21.12.2020,"Балчик, Батово, Бранище, Владимирово, Добрич, Дропла, Зърнево, Каварна, Кранево, Крушари, Ловчанци, Телериг, Тервел, Храброво, Шабла"
20.12.2020,"Добрич, Спасово"
18.12.2020,"Балчик, Безводица, Добрич, Дропла, Каварна, Кранево, Лясково, Нейково, Одърци, Сноп, Тянево, Черна, Шабла"
17.12.2020,"Балчик, Владимирово, Гурково, Добрич, Долина, Змеево, Каварна, Камен, Кочмар, Къпиново, Лясково, Овчарово, Орляк, Преселенци, Рогозина, Тервел, Тянево, Черна, Шабла"
16.12.2020,"Балчик, Безводица, Бобовец, Бранище, Гешаново, Добрич, Долина, Житен, Зограф, Йовково, Каварна, Огражден, Паскалево, Поручик Чунчево, Стражица, Тервел"
15.12.2020,"Алцек, Балчик, Бдинци, Видно, Вратарите, Гурково, Добрич, Дропла, Дъбрава, Змеево, Каварна, Малина, Паскалево, Сенокос, Стожер, Тервел, Тригорци, Тюленово, Шабла"
14.12.2020,"Балчик, Батово, Великово, Добрич, Драганово, Стожер"
12.12.2020,"Балчик, Белгун, Бранище, Добрич, Каварна, Лозенец, Люляково"
11.12.2020,"Балканци, Балчик, Бранище, Добрич, Земенци, Каварна, Крушари, Овчарово, Одринци, Преселенци, Рогозина, Свобода, Тервел, Тюленово, Шабла"
10.12.2020,"Балчик, Добрич, Долина, Каварна, Ловчанци, Поручик Чунчево, Раковски, Тервел, Тюленово, Хаджи Димитър, Шабла"
09.12.2020,"Балчик, Василево, Добрич, Долина, Каварна, Коларци, Крушари, Лозенец, Преселенци, Тервел, Тюленово, Шабла"
08.12.2020,"Балчик, Гешаново, Добрич, Кардам, Коларци, Кремена, Крушари, Росеново, Тервел, Тюленово, Хаджи Димитър, Шабла"
07.12.2020,"Балчик, Добрич, Каварна, Камен, Крушари, Малина, Малка Смолница, Нова Камена, Ново Ботево, Пчелник, Смолница, Сноп, Тервел, Тригорци, Тюленово, Шабла"
04.12.2020,"Балчик, Добрич, Драганово, Земенци, Каварна, Крушари, Ловчанци, Малина, Рогачево, Тюленово, Шабла"
03.12.2020,"Балчик, Владимирово, Добрич, Земенци, Каварна, Камен, Кардам, Крушари, Лясково, Опанец, Преселенци, Рогачево, Шабла"
02.12.2020,"Ангеларий, Балчик, Добрич, Карапелит, Крушари, Лясково, Ново Ботево, Рогачево, Росеново, Телериг, Тервел, Шабла"
01.12.2020,"Балчик, Добрич, Изворово, Иречек, Каварна, Крушари, Малина, Рогачево, Телериг, Шабла"
30.11.2020,"Балчик, Безмер, Добрич, Каварна, Камен, Камен бряг, Крушари, Лозенец, Паскалево, Рогачево, Телериг, Тервел, Шабла"
28.11.2020,"Добрич, Самуилово"
27.11.2020,"Балчик, Воднянци, Добрич, Каварна, Коларци, Крапец, Тервел, Шабла"
26.11.2020,"Балчик, Вичово, Добрич, Каварна, Лясково, Овчарово, Пчелник, Септемврийци, Стражица, Шабла"
25.11.2020,"Балчик, Бранище, Добрич, Житен, Каварна, Коритен, Крушари, Рогачево, Свети Никола"
24.11.2020,"Ангеларий, Балчик, Добрич, Жегларци, Житница, Каварна, Кочмар, Крушари, Мали извор, Рогачево, Тервел, Шабла"
23.11.2020,"Алцек, Балчик, Добрич, Жегларци, Каварна, Красен, Крушари, Нейково, Ново Ботево, Одринци, Приморци, Рогачево, Тервел, Шабла"
22.11.2020,"Балчик, Добрич, Рогачево"
21.11.2020,"Балчик, Добрич, Рогачево"
20.11.2020,"Алцек, Балчик, Вичово, Врачанци, Добрич, Долина, Каварна, Козлодуйци, Кочмар, Малка Смолница, Приморци, Рогачево, Смолница, Тервел, Шабла"
19.11.2020,"Алцек, Балчик, Ваклино, Вичово, Гешаново, Добрич, Драганово, Каварна, Овчарово, Раковски, Рогачево, Хитово, Шабла"
18.11.2020,"Балчик, Ваклино, Добрич, Каварна, Одърци, Рогачево, Смин, Смолница, Шабла"
17.11.2020,"Балчик, Божаново, Добрич, Житен, Каварна, Кардам, Крушари, Рогачево, Северняк, Селце, Смолница, Тянево, Шабла"
16.11.2020,"Балчик, Богдан, Генерал Колево, Гешаново, Добрич, Житница, Изворово, Каварна, Кочмар, Красен, Крушари, Ловчанци, Лозенец, Пчелник, Рогачево, Тервел, Тюленово, Тянево, Шабла"
14.11.2020,"Балчик, Добрич"
13.11.2020,"Балчик, Видно, Добрич, Каварна, Кранево, Крушари, Лясково, Методиево, Оброчище, Стефаново, Стожер, Сърнец, Твърдица, Телериг, Тервел, Шабла"
12.11.2020,"Абрит, Балчик, Бдинци, Владимирово, Вратарите, Добрич, Каварна, Крушари, Лясково, Нова Камена, Пчеларово, Рогачево, Смолница, Твърдица, Тервел, Шабла"
11.11.2020,"Балчик, Божаново, Българево, Добрич, Житен, Житница, Каварна, Кардам, Крушари, Лясково, Рогачево, Сенокос, Стожер, Твърдица, Шабла"
10.11.2020,"Абрит, Балчик, Бенковски, Добрич, Йовково, Каварна, Крушари, Медово, Методиево, Плачидол, Самуилово, Смолница, Твърдица, Царичино, Шабла"
